{
  "artifact_relative_paths": [
    "annotations/ligand_annotations.parquet",
    "annotations/pair_structural_descriptors.parquet",
    "annotations/perturbation_descriptors.parquet",
    "annotations/residue_structural_descriptors.parquet",
    "core/benchmark_instances.parquet",
    "core/condition_pairs.parquet",
    "core/proteins.parquet",
    "core/residue_mappings.parquet",
    "core/splits.parquet",
    "core/structures.parquet",
    "metadata/benchmark_definition.json",
    "metadata/clustering_protocol.json",
    "metadata/evaluator_protocol.json",
    "metadata/generation_protocol.json",
    "metadata/release_manifest.json",
    "metadata/split_protocol.json",
    "metadata/statistical_protocol.json",
    "tracks/track_i_invariance.parquet",
    "tracks/track_ii_sensitivity.parquet"
  ],
  "benchmark_name": "StructCal",
  "benchmark_version": "1.0.0",
  "code_revision": "e644e20a60dc51cfb59640e4b9a1637011e84427",
  "creation_metadata": {
    "created_at_utc": "2026-08-22T10:58:14.807534+00:00",
    "materializer": "dual_uq.dataset.structcal_release.materialize_structcal_v1",
    "working_tree_state": "DIRTY_UNCOMMITTED_AUTHORIZED_TASK_CONTEXT"
  },
  "outcome_leakage_audit": {
    "model_dependent_inputs_read": [],
    "outcome_leakage": 0
  },
  "protocol_versions": {
    "clustering": "structcal_global_identity_30_v1",
    "evaluator": "structcal_evaluator_v1",
    "generation": "structcal_generation_v1",
    "split": "structcal_global_cluster_split_v1",
    "statistical": "structcal_statistical_v1"
  },
  "release_id": "structcal_v1",
  "release_status": "RELEASED",
  "row_counts": {
    "annotations/ligand_annotations.parquet": 61135,
    "annotations/pair_structural_descriptors.parquet": 2418,
    "annotations/perturbation_descriptors.parquet": 567,
    "annotations/residue_structural_descriptors.parquet": 643102,
    "core/benchmark_instances.parquet": 2545,
    "core/condition_pairs.parquet": 2545,
    "core/proteins.parquet": 1897,
    "core/residue_mappings.parquet": 912442,
    "core/splits.parquet": 1897,
    "core/structures.parquet": 4607,
    "tracks/track_i_invariance.parquet": 68,
    "tracks/track_ii_sensitivity.parquet": 1851
  },
  "schema_version": "2.0.0",
  "source_release_identities": [
    "experiments/p2_design_baseline/scale1/scale1b_v2/scale1b_v2_primary_cohort.parquet",
    "experiments/p2_design_baseline/scale1/scale1b_v2/scale1b_v2_primary_common_masks.parquet",
    "experiments/p2_design_baseline/scale1b-v2/pair_validity/pair_validity.parquet",
    "experiments/interventions/biological_states/apo_holo_selective_admission_release/primary_pairs.parquet",
    "experiments/interventions/biological_states/apo_holo_selective_admission_release/candidate_structures.parquet",
    "experiments/interventions/biological_states/apo_holo_selective_admission_release/residue_mappings.parquet",
    "experiments/interventions/biological_states/apo_holo_selective_admission_release/pair_structural_descriptors.parquet",
    "experiments/interventions/biological_states/apo_holo_selective_admission_release/residue_structural_descriptors.parquet",
    "experiments/interventions/biological_states/apo_holo_selective_admission_release/ligand_sites.parquet",
    "experiments/interventions/functional_states/construction/functional_state_admission/primary_pairs.parquet",
    "structcal/core/proteins.parquet",
    "structcal/core/structures.parquet",
    "structcal/core/condition_pairs.parquet",
    "structcal/core/residue_mappings.parquet",
    "structcal/core/benchmark_instances.parquet",
    "structcal/annotations/pair_structural_descriptors.parquet",
    "structcal/annotations/residue_structural_descriptors.parquet",
    "experiments/interventions/controlled_perturbations/relational_geometry_confirmatory/parent_cohort.parquet",
    "experiments/interventions/controlled_perturbations/relational_geometry_confirmatory/geometry/selected_instances.parquet",
    "experiments/interventions/controlled_perturbations/relational_geometry_confirmatory/geometry/structural_descriptors.parquet",
    "experiments/comparisons/method_design/identity_split/cluster_assignments.parquet"
  ],
  "summary": {
    "global_clustering": {
      "identity_clusters": 1350,
      "largest_cluster_size": 38,
      "multi_protein_clusters": 221,
      "proteins_clustered": 1897,
      "singleton_clusters": 1129
    },
    "global_protein_universe": {
      "arm_unique_proteins": {
        "controlled_perturbation": 98,
        "functional_state": 413,
        "ligand_state": 1410,
        "representation_variation": 113
      },
      "cross_arm_overlap": {
        "functional_state__controlled_perturbation": 2,
        "ligand_state__controlled_perturbation": 98,
        "ligand_state__functional_state": 29,
        "representation_variation__controlled_perturbation": 1,
        "representation_variation__functional_state": 2,
        "representation_variation__ligand_state": 9
      },
      "unique_proteins": 1897
    },
    "global_split": {
      "arm_pairs_per_split": {
        "LOCKED_TEST": {
          "controlled_perturbation": 105,
          "functional_state": 70,
          "ligand_state": 211,
          "representation_variation": 20
        },
        "TRAIN": {
          "controlled_perturbation": 360,
          "functional_state": 303,
          "ligand_state": 989,
          "representation_variation": 87
        },
        "VALIDATION": {
          "controlled_perturbation": 102,
          "functional_state": 68,
          "ligand_state": 210,
          "representation_variation": 20
        }
      },
      "cluster_leakage": 0,
      "clusters_per_split": {
        "LOCKED_TEST": 94,
        "TRAIN": 1164,
        "VALIDATION": 92
      },
      "length_bins_per_split": {
        "LOCKED_TEST": {
          "200_399": 109,
          "400_799": 80,
          "GE_800": 21,
          "LT_200": 62
        },
        "TRAIN": {
          "200_399": 499,
          "400_799": 416,
          "GE_800": 169,
          "LT_200": 265
        },
        "VALIDATION": {
          "200_399": 130,
          "400_799": 94,
          "GE_800": 23,
          "LT_200": 29
        }
      },
      "pairs_per_split": {
        "LOCKED_TEST": 406,
        "TRAIN": 1739,
        "VALIDATION": 400
      },
      "proteins_per_split": {
        "LOCKED_TEST": 272,
        "TRAIN": 1349,
        "VALIDATION": 276
      },
      "state_family_pairs_per_split": {
        "LOCKED_TEST": {
          "ACTIVE_INACTIVE": 6,
          "INWARD_OUTWARD": 13,
          "OPEN_CLOSED": 48,
          "RESTING_ACTIVATED": 3
        },
        "TRAIN": {
          "ACTIVE_INACTIVE": 21,
          "INWARD_OUTWARD": 39,
          "OPEN_CLOSED": 227,
          "RESTING_ACTIVATED": 16
        },
        "VALIDATION": {
          "ACTIVE_INACTIVE": 6,
          "INWARD_OUTWARD": 11,
          "OPEN_CLOSED": 48,
          "RESTING_ACTIVATED": 3
        }
      }
    },
    "tracks": {
      "track_i_invariance": {
        "clusters": 57,
        "pairs": 68,
        "proteins": 60,
        "roles": {
          "INVARIANCE_NATURALISTIC": 68
        },
        "state_families": {}
      },
      "track_ii_sensitivity": {
        "clusters": 1257,
        "pairs": 1851,
        "proteins": 1794,
        "roles": {
          "SENSITIVITY_APO_HOLO": 1410,
          "SENSITIVITY_FUNCTIONAL_STATE": 441
        },
        "state_families": {
          "ACTIVE_INACTIVE": 33,
          "INWARD_OUTWARD": 63,
          "OPEN_CLOSED": 323,
          "RESTING_ACTIVATED": 22
        }
      }
    }
  },
  "validation": {
    "foreign_keys_valid": true,
    "identity_cluster_leakage": 0,
    "mapping_key_unique": true,
    "mapping_semantics_valid": true,
    "outcome_leakage": 0,
    "pair_key_unique": true,
    "pair_structure_identity_valid": true,
    "protein_key_unique": true,
    "track_integrity_valid": true,
    "track_iii_duplicate_cohort": false
  }
}
